{
  "schemaVersion": "1.0",
  "generatedAt": "2026-03-31T07:14:43.308Z",
  "preferredWebRuntime": "python",
  "summary": {
    "moduleCount": 13,
    "boardCount": 5,
    "projectCount": 4
  },
  "roots": [
    {
      "nodeId": "modules-root",
      "nodeKind": "root",
      "title": "Modules",
      "sourcePath": null,
      "metadata": {
        "domain": "modules"
      },
      "children": [
        {
          "nodeId": "module:axp2101",
          "nodeKind": "module",
          "title": "AXP2101 PMU",
          "sourcePath": "project/parts/devices/axp2101.json",
          "metadata": {
            "moduleId": "axp2101",
            "partType": "device",
            "catalogRole": "device",
            "vendor": "X-Powers",
            "interfaces": [
              "i2c",
              "interrupt"
            ],
            "packageId": null,
            "mcuId": null,
            "defaultConfig": {
              "i2cAddress": "0x34",
              "interruptActiveLevel": "low"
            },
            "supportsComposition": false,
            "api": {
              "highLevel": [
                {
                  "name": "pmu_read_status",
                  "description": "Read current power-path, battery, and charger status."
                },
                {
                  "name": "pmu_set_charge_policy",
                  "description": "Apply project-local battery charge configuration."
                },
                {
                  "name": "pmu_configure_wakeup",
                  "description": "Enable or disable wake sources exposed by the PMU."
                }
              ]
            },
            "docs": {
              "datasheet": "https://m5stack.oss-cn-shenzhen.aliyuncs.com/resource/docs/datasheet/core/CoreS3/AXP2101_Datasheet_V1.0_en.pdf",
              "website": "https://docs.m5stack.com/en/core/CoreS3",
              "apiGuide": "project/help/parts/axp2101.md"
            }
          },
          "children": [
            {
              "nodeId": "module:axp2101:guide",
              "nodeKind": "help-reference",
              "title": "API Guide",
              "sourcePath": "project/help/parts/axp2101.md",
              "metadata": {
                "kind": "apiGuide",
                "path": "project/help/parts/axp2101.md"
              },
              "children": []
            },
            {
              "nodeId": "module:axp2101:datasheet",
              "nodeKind": "help-reference",
              "title": "Datasheet",
              "sourcePath": null,
              "metadata": {
                "kind": "datasheet",
                "href": "https://m5stack.oss-cn-shenzhen.aliyuncs.com/resource/docs/datasheet/core/CoreS3/AXP2101_Datasheet_V1.0_en.pdf"
              },
              "children": []
            },
            {
              "nodeId": "module:axp2101:website",
              "nodeKind": "help-reference",
              "title": "Website",
              "sourcePath": null,
              "metadata": {
                "kind": "website",
                "href": "https://docs.m5stack.com/en/core/CoreS3"
              },
              "children": []
            }
          ]
        },
        {
          "nodeId": "module:bm8563",
          "nodeKind": "module",
          "title": "BM8563 RTC",
          "sourcePath": "project/parts/devices/bm8563.json",
          "metadata": {
            "moduleId": "bm8563",
            "partType": "device",
            "catalogRole": "device",
            "vendor": "Belling",
            "interfaces": [
              "i2c"
            ],
            "packageId": null,
            "mcuId": null,
            "defaultConfig": {
              "i2cAddress": "0x51"
            },
            "supportsComposition": false,
            "api": {
              "highLevel": [
                {
                  "name": "rtc_get_time",
                  "description": "Read current wall-clock time from the RTC."
                },
                {
                  "name": "rtc_set_time",
                  "description": "Write a new wall-clock time into the RTC."
                },
                {
                  "name": "rtc_configure_alarm",
                  "description": "Configure a wake or alarm event using board-local policy."
                }
              ]
            },
            "docs": {
              "datasheet": "https://m5stack.oss-cn-shenzhen.aliyuncs.com/resource/docs/datasheet/unit/BM8563.pdf",
              "website": "https://docs.m5stack.com/en/unit/rtc",
              "apiGuide": "project/help/parts/bm8563.md"
            }
          },
          "children": [
            {
              "nodeId": "module:bm8563:guide",
              "nodeKind": "help-reference",
              "title": "API Guide",
              "sourcePath": "project/help/parts/bm8563.md",
              "metadata": {
                "kind": "apiGuide",
                "path": "project/help/parts/bm8563.md"
              },
              "children": []
            },
            {
              "nodeId": "module:bm8563:datasheet",
              "nodeKind": "help-reference",
              "title": "Datasheet",
              "sourcePath": null,
              "metadata": {
                "kind": "datasheet",
                "href": "https://m5stack.oss-cn-shenzhen.aliyuncs.com/resource/docs/datasheet/unit/BM8563.pdf"
              },
              "children": []
            },
            {
              "nodeId": "module:bm8563:website",
              "nodeKind": "help-reference",
              "title": "Website",
              "sourcePath": null,
              "metadata": {
                "kind": "website",
                "href": "https://docs.m5stack.com/en/unit/rtc"
              },
              "children": []
            }
          ]
        },
        {
          "nodeId": "module:esp32_wroom_32",
          "nodeKind": "module",
          "title": "ESP32-WROOM-32",
          "sourcePath": "project/parts/modules/esp32_wroom_32.json",
          "metadata": {
            "moduleId": "esp32_wroom_32",
            "partType": "module",
            "catalogRole": "controller",
            "vendor": "Espressif",
            "interfaces": [],
            "packageId": "esp32_wroom_32_package",
            "mcuId": "esp32",
            "defaultConfig": {},
            "supportsComposition": false,
            "api": null,
            "docs": {
              "datasheet": null,
              "website": null,
              "apiGuide": null
            }
          },
          "children": []
        },
        {
          "nodeId": "module:ft3267",
          "nodeKind": "module",
          "title": "FT3267 Touch Controller",
          "sourcePath": "project/parts/devices/ft3267.json",
          "metadata": {
            "moduleId": "ft3267",
            "partType": "device",
            "catalogRole": "device",
            "vendor": "FocalTech",
            "interfaces": [
              "i2c",
              "interrupt"
            ],
            "packageId": null,
            "mcuId": null,
            "defaultConfig": {
              "i2cAddress": "0x38",
              "interruptActiveLevel": "low"
            },
            "supportsComposition": false,
            "api": {
              "highLevel": [
                {
                  "name": "touch_is_present",
                  "description": "Return whether the controller responded during setup."
                },
                {
                  "name": "touch_read_points",
                  "description": "Read the current touch points from the controller."
                },
                {
                  "name": "touch_irq_active",
                  "description": "Read the board-mapped interrupt state for event-driven input."
                }
              ]
            },
            "docs": {
              "datasheet": "https://focuslcds.com/content/FT3267.pdf",
              "website": "https://docs.m5stack.com/en/core/M5Dial%20V1.1",
              "apiGuide": "project/help/parts/ft3267.md"
            }
          },
          "children": [
            {
              "nodeId": "module:ft3267:guide",
              "nodeKind": "help-reference",
              "title": "API Guide",
              "sourcePath": "project/help/parts/ft3267.md",
              "metadata": {
                "kind": "apiGuide",
                "path": "project/help/parts/ft3267.md"
              },
              "children": []
            },
            {
              "nodeId": "module:ft3267:datasheet",
              "nodeKind": "help-reference",
              "title": "Datasheet",
              "sourcePath": null,
              "metadata": {
                "kind": "datasheet",
                "href": "https://focuslcds.com/content/FT3267.pdf"
              },
              "children": []
            },
            {
              "nodeId": "module:ft3267:website",
              "nodeKind": "help-reference",
              "title": "Website",
              "sourcePath": null,
              "metadata": {
                "kind": "website",
                "href": "https://docs.m5stack.com/en/core/M5Dial%20V1.1"
              },
              "children": []
            }
          ]
        },
        {
          "nodeId": "module:gc9a01",
          "nodeKind": "module",
          "title": "GC9A01 Round LCD Controller",
          "sourcePath": "project/parts/devices/gc9a01.json",
          "metadata": {
            "moduleId": "gc9a01",
            "partType": "device",
            "catalogRole": "device",
            "vendor": "GalaxyCore",
            "interfaces": [
              "spi"
            ],
            "packageId": null,
            "mcuId": null,
            "defaultConfig": {
              "pixelFormat": "RGB565"
            },
            "supportsComposition": false,
            "api": {
              "highLevel": [
                {